{
  "schema_version": "0.3.0-draft",
  "demonstration_role": "possible_realization",
  "coverage_profile": "v0.2",
  "exercise": {
    "id": "conformance-ligadura",
    "title": "Conformidad — ligadura de prolongación que cruza la barra (C2)",
    "source": {
      "kind": "original",
      "author": null,
      "reference": null,
      "octave_convention": "cientifica",
      "rights": null
    },
    "evidence_default": "[documentado]"
  },
  "musical_semantics": {
    "time": {
      "signature": "4/4",
      "beats_per_measure": 4,
      "beat_unit": "1/4",
      "bpm": 60,
      "tempo_term": null
    },
    "key": { "tonic": "C", "mode": "major" },
    "measures": 2,
    "voices": [
      {
        "id": "v1",
        "kind": "melodic",
        "events": [
          {
            "id": "e01",
            "measure": 1,
            "beat": "1/1",
            "duration": "4/4",
            "notes": [{ "id": "n01", "written_pitch": { "step": "C", "alter": 0, "octave": 4 } }]
          },
          {
            "id": "e02",
            "measure": 2,
            "beat": "1/1",
            "duration": "4/4",
            "tied_from_previous": true,
            "notes": [{ "id": "n02", "written_pitch": { "step": "C", "alter": 0, "octave": 4 } }]
          }
        ]
      }
    ]
  },
  "instrument_realization": {
    "kind": "piano",
    "exercise_range": {
      "low": { "step": "C", "alter": 0, "octave": 4 },
      "high": { "step": "C", "alter": 0, "octave": 4 }
    },
    "realizations": [
      { "note_id": "n01", "hand": "left", "finger": 5 },
      { "note_id": "n02", "hand": "left", "finger": 5 }
    ]
  },
  "text_and_vocal_alignment": null,
  "presentation_and_rendering": {
    "type": "reproducible",
    "views": ["staff_treble", "keyboard"],
    "controls": ["play", "pause", "restart", "bpm_slider", "loop"],
    "bpm_initial": 60,
    "engine_suggested": null,
    "hand_colors": { "right": "naranja", "left": "azul" }
  },
  "evidence_governance": {
    "aprobado_por_david": false,
    "listo_para_desarrollo": false,
    "validacion_profesional": "no-requerida",
    "transposition_allowed": false,
    "unknown_notation": [],
    "unsupported_features": [],
    "field_evidence": null
  }
}
